 Deel vanmiddag de resultaten van het hersenonderzoek aan de patiënt  mee   .,48
 Geef voorlopig geen nieuwe medicijnen aan deze patiënte     .,48
 Raad voornamelijk een evenwichtiger eetpatroon aan de zwaarlijvige man  voor   .,48
 Lever voorlopig geen nieuwe producten aan dat tuincentrum     .,48
 Overhandig vanmiddag de sleutels van het huis aan de nieuwe bewoners     .,48
 Verkoop toch dat mooie schilderijtje aan mij     .,48
 Leg nauwkeurig de veiligheidsvoorschriften aan de nieuwe werknemers  uit   .,48
 Raad nogmaals een andere arts aan hem  aan   .,48
 Leg nogmaals de werking van het hart aan de derdejaars  uit   .,48
 Vertel nogmaals de datum van de toetsweek aan de ouders van de brugklassers     .,48
 Schenk regelmatig een beetje kleingeld aan de collectant     .,48
 Lees regelmatig een leuk gedichtje aan jouw neefjes  voor   .,48
 Leg nauwkeurig de spelregels van dat kaartspelletje aan jouw vrienden  uit   .,48
 Draag tijdens het vertrouwelijke overleg dit dossier aan de minister van financiën  over   .,48
 Overhandig na de middagpauze dit vergrootglas aan de slechtziende vrouw     .,48
 Geef na het avondeten deze medicijnen aan mevrouw Langendijk     .,48
 Schrijf aanvankelijk geen zwaardere medicijnen aan de geopereerde nierpatiënt  voor   .,48
 Raad aanvankelijk een ander dieet aan de patiënt  aan   .,48
 Leen nooit geld aan die onbetrouwbare jongen     .,48
 Leg bij voorbaat de nieuwe overgangsnormen aan de studenten  uit   .,48
 Geef in eerste instantie een waarschuwing aan de automobilist     .,48
 Geef onmiddellijk een fikse bekeuring aan de automobilist     .,48
 Draag onmiddellijk de overmeesterde overvallers aan de politie  over   .,48
 Bied na de finish de uitgedroogde wielrenners een fles mineraalwater  aan   .,48
 Lees nooit enge verhalen aan jonge kinderen  voor   .,48
 Stuur morgen dat eindverslag aan de directeur     .,48
 Vertel nooit mijn geheimen aan hem     .,48
 Leer de volgende les het tweede deel van de dans aan de enthousiaste danseressen     .,48
 Overhandig na afloop van het concert dit bronzen beeldje aan de Chinese pianist     .,48
 Stuur elke dag een lief berichtje aan mij     .,48
 Geef na het laatste fluitsignaal een hand aan de tegenstanders     .,48
 Raad toch dat leuke Chinese restaurant aan jouw vrienden  aan   .,48
 Verkoop alsjeblieft jouw Chinese porselein aan die rijke kunsthandelaar     .,48
 Overhandig met een grote glimlach de diploma's aan de geslaagde eindexamenkandidaten     .,48
 Raad eventueel dat Spaanse tapasrestaurantje aan de toeristen  aan   .,48
 Laat na mijn dood mijn erfenis aan het dierenasiel  na   .,48
 Deel straks het gewijzigde aankomstperron aan de reizigers  mee   .,48
 Deel tijdens de ingelaste persconferentie het aftreden van de minister-president aan de journalisten  mee   .,48
 Geef elke maand een beetje kunstmest aan de rozenstruik     .,48
 Vertel altijd de waarheid aan jouw ouders     .,48
 Geef dat boek onmiddellijk aan mij     .,49
 Lever deze bestelling vanmiddag aan dat restaurant     .,49
 Draag de winkeldieven meteen aan de politie over    .,49
 Draag de macht binnen twee weken aan uw opvolger over    .,49
 Draag het dossier van deze patiënt straks aan de nachtploeg over    .,49
 Draag de jonge piraten morgen aan de Somalische regering over    .,49
 Laat jouw postzegelverzameling eventueel aan hem na    .,49
 Overhandig de rekening met een vriendelijke glimlach aan de gasten     .,49
 Overhandig deze gevonden koffer onmiddellijk aan de politie     .,49
 Draag deze landmijn onmiddellijk aan de explosievenopruimingsdienst over    .,49
 Overhandig het openstaande geldbedrag aan het eind van de week aan de schuldeiser     .,49
 Geef zijn schoenen onmiddellijk aan hem terug    .,49
 Verkoop jouw dierbare sieraden nooit aan iemand     .,49
 Leen jouw aantekeningen alsjeblieft aan mij     .,49
 Verkoop jouw horloge bij een goed bod aan die handelaar     .,49
 Leen jouw oude rolschaatsen toch aan haar     .,49
 Bied jouw excuses onmiddellijk aan hem aan    .,49
 Deel de resultaten van het onderzoek onmiddellijk aan de patiënt mee    .,49
 Deel de eindexamenresultaten vanmiddag aan de zenuwachtige jongens en meisjes mee    .,49
 Deel de val van het kabinet tijdens de persconferentie aan de bevolking mee    .,49
 Schrijf deze medicijnen nooit aan diabetespatiënten voor    .,49
 Schrijf dit speciale voer alleen aan honden met nierproblemen voor    .,49
 Raad dit romantische boek vooral aan jonge vrouwen voor    .,49
 Raad dat ongezonde dieet altijd aan iedereen af    .,49
 Raad tatoeages in ieder geval aan minderjarigen af    .,49
 Vertel een spannend verhaal tijdens dat tussenuurtje aan die klas     .,49
 Lees dat gruwelijke verhaal nooit aan jonge kinderen voor    .,49
 Geef jouw telefoonnummer nooit aan vreemden     .,49
 Geef dit cadeau straks aan oma     .,49
 Geef jouw paspoort straks aan de douanier     .,49
 Geef de afstandsbediening van de televisie nu aan mij     .,49
 Geef nu een servetje aan haar     .,49
 Lever deze levende kreeften voor vanavond aan dat visrestaurant     .,49
 Geef zijn telefoon nu aan hem terug    .,49
 Laat jouw bijzondere boekencollectie eventueel aan een universiteitsbibliotheek na    .,49
 Laat die bijzondere prenten anders aan dat museum na    .,49
 Laat jouw verzameling botten en schedels anders aan een middelbare school na    .,49
 Overhandig deze oorkonde tijdens de ceremonie aan de pianiste     .,49
 Overhandig deze gouden medaille na een korte toespraak aan de winnaar van de finale     .,49
 Overhandig deze bos bloemen straks aan haar     .,49
 Overhandig het wisselgeld met een vriendelijke glimlach aan de klant     .,49
 Verkoop alcohol en sigaretten nooit aan minderjarigen     .,49
 Verkoop deze medicijnen alleen op doktersrecept aan klanten     .,49
 Leen jouw oude laptop toch aan mij     .,49
 Leen jouw oude kinderboeken toch aan jouw neefje     .,49
 Leen die gereedschapskist nooit meer aan jouw broer     .,49
 Leen jouw uittreksels alsjeblieft aan mij     .,49
 Deel de omleiding nogmaals aan de reizigers mee    .,49
 Deel slecht nieuws persoonlijk aan patiënten mee    .,49
 Raad deze film echt aan iedereen aan    .,49
 Raad hun geplande reis naar dat oorlogsgebied absoluut aan die onervaren persfotografen af    .,49
 Vertel dat bizarre verhaal straks aan haar ouders     .,49
 Vertel de geschiedenis van de Oude kerk uitgebreid aan de Duitse toeristen     .,49
 Raad onze dagschotel altijd aan de gasten aan    .,49
 Raad het gebruik van vitaminepillen vooral aan jonge kinderen af    .,49
 Stuur een leuk kaartje tijdens kerst aan je collega's     .,49
 Stuur deze mooie kaart tijdens kerst aan jouw opa     .,49
 Stuur je sollicitatiebrief vóór achttien mei aan het ziekenhuis     .,49
 Stuur je ingevulde belastingformulier vóór één april aan ons     .,49
 Stuur uw verklaring binnen een week aan de politie     .,49
 Geef jouw zonnebril even aan mij     .,49
 Geef het adresboekje even aan mij     .,49
 Geef die leesbril onmiddellijk aan je vader terug    .,49
 Geef je pincode nooit aan andere mensen     .,49
 Geef je telefoonnummer nooit aan onbekende mensen     .,49
 Geef je adresgegevens nooit aan onbekenden     .,49
 Geef je adresgegevens nooit aan vreemde mensen     .,49
 Draag die taken onmiddellijk aan iemand over    .,49
 Overhandig de oranje overalls straks aan de nieuwe gevangenen     .,49
 Overhandig dat bronzen beeldje na betaling aan de nieuwe eigenaar     .,49
 Overhandig dit vertrouwelijke dossier morgenochtend aan de advocaat     .,49
 Overhandig de pasgeboren tweeling na de controle aan de trotse vader     .,49
 Overhandig dit cadeautje straks aan jouw zusje     .,49
 Geef de ladder straks aan de buurman     .,49
 Bied de gasten na binnenkomst een welkomstdrankje aan    .,49
 Deel het ontslag van de minister later op de dag aan de koning mee    .,49
 Geef zijn rugzak onmiddellijk aan hem terug    .,49
 Overhandig de diploma's na de toespraak van de conrector aan de geslaagde leerlingen     .,49
 Overhandig de sleutels van de gloednieuwe auto zo spoedig mogelijk aan de gelukkige winnaars     .,49
 Leg jouw goocheltruc nooit aan het publiek uit    .,49
 Leg die moeilijke wiskundesom uitgebreid aan de leerlingen uit    .,49
 Leg deze verkeersregels uitgebreid aan de kinderen van groep zeven uit    .,49
 Leg de regels van dat spelletje goed aan hen uit    .,49
 Leg de bijwoordelijke bepaling uitvoerig aan de brugklassers uit    .,49
 Leg de werking van het oog morgen aan de tweedeklassers uit    .,49
 Leg de functie van de nieren morgen aan de eersteklassers uit    .,49
 Leg jouw keuzes straks aan ons uit    .,49
 Raad deze gevaarlijke route nooit aan iemand aan    .,49
 Raad dit geneesmiddel nooit aan professionele sporters aan    .,49
 Overhandig de eresleutel van de stad straks aan onze oudste inwoner     .,49
 Overhandig de gouden plaat na het optreden aan de dj     .,49
 Overhandig de jaarkalender vanmiddag aan jouw collega's     .,49
 Overhandig deze zeer bijzondere archeologische vondst morgen aan de directeur van het museum     .,49
 Lever deze bloemen vóór twaalf uur aan de kapsalon     .,49
 Leen jullie extra slaapmatjes toch aan die onervaren kampeerders     .,49
 Leen jullie auto voor een middagje aan mij     .,49
 Raad ons restaurant alsjeblieft aan jullie vrienden en familie aan    .,49
 Leg de schoolregels één voor één aan de nieuwe brugklassers uit    .,49
 Vertel die spannende Griekse mythe nogmaals aan onze klas     .,49
 Raad die sportarts na jouw slechte ervaringen aan jouw collega's af    .,49
 Lever deze verse vruchten straks aan dat restaurant     .,49
 Bij het boerenbedrijf hebben de werknemers gestaakt     .,50
 Waarom huilde jouw zusje      .,50
 Wanneer zal ons vliegtuig vertrekken     .,50
 Hoe kon die zeecontainer omslaan     .,50
 Morgen gaan de tram- en busschauffers staken     .,50
 Op de gladde stoep is mijn oude buurvrouw uitgegleden     .,50
 Na het eindsignaal hebben de supporters van de thuisploeg gejuicht     .,50
 In de laatste seconde van de verlenging heeft de spits van de tegenpartij gescoord     .,50
 Tijdens elk feestje klagen onze buren      .,50
 Sinds twee maanden klemt mijn slaapkamerdeur      .,50
 Na twee uurtjes moesten de wegwerkers pauzeren     .,50
 Afgelopen week is die gevaarlijke crimineel ontsnapt     .,50
 Na de zwemles bibberden de kleine kinderen      .,50
 Waarom is zijn recordpoging mislukt     .,50
 Waarom heb je gelogen     .,50
 Hoe reageerden de leraren      .,50
 Hoe laat landt het vliegtuig van jouw oma      .,50
 In 1886 brandde de toren van deze kerk  af    .,50
 Na het bombardement zijn een aantal monumentale panden ingestort     .,50
 Tijdens het wiskunde-examen had de eindexamenkandidate gespiekt     .,50
 Na het optreden van de cabaretier heeft het publiek geapplaudisseerd     .,50
 Hoe laat landen we      .,50
 Na het onverwachte verlies baalden de supporters      .,50
 Elke winter gaat mijn familie skiën     .,50
 Plotseling daalde het vliegtuig      .,50
 Aanstaande woensdag zal mijn favoriete band optreden     .,50
 Waar zullen de kosmonauten landen     .,50
 Door de dijkdoorbraak waren veel koeien verdronken     .,50
 Waarom moest je lachen     .,50
 Na het ongeluk schreeuwde de geschrokken automobilist      .,50
 Door de airconditioning is de temperatuur gedaald     .,50
 Door de extreme hitte waren onze ijsjes gesmolten     .,50
 De hele nacht heeft mijn broertje gehuild     .,50
 Tijdens het onderzoek bleef de wielrenner liegen     .,50
 Overal kan ik slapen     .,50
 Tijdens de uitleg van de docent bleef mijn klasgenootje gapen     .,50
 Door het sms'je moest het verliefde meisje glimlachen     .,50
 Na de lange winter sputterde de motor van onze boot      .,50
 Tot 21 december zal dit boek uitgeleend zijn     .,50
 Door de zware lading is het grote schip vastgelopen     .,50
 Hoe heb jij geslapen     .,50
 Wanneer speelt jouw voetbalteam      .,50
 Wanneer mogen we uitrusten     .,50
 De hele dag hebben mijn neefjes en ik gestoeid     .,50
 Door een list zijn de gevangenen ontsnapt     .,50
 Afgelopen jaar is de prijs van goud gestegen     .,50
 Door het gezang op de tribune steeg het enthousiasme van de voetballers      .,50
 Binnen vijf minuten sloeg het weer  om    .,50
 Met zijn gezondheid bleef de oude man sukkelen     .,50
 Ondanks het onweer is het vliegtuig opgestegen     .,50
 Na de enorme explosie is het marineschip gezonken     .,50
 In de winter blijft dit bijzondere plantje bloeien     .,50
 Waarom moest jouw broertje huilen     .,50
 Wanneer gaan we dansen     .,50
 Door dit zalfje is mijn huiduitslag verdwenen     .,50
 Door de verkeerde aanwijzingen zijn de spoorzoekers verdwaald     .,50
 Na het geweldige doelpunt applaudisseerden de uitbundige supporters      .,50
 Na de kilometerslange klim moesten de fietsers uitrusten     .,50
 Gedurende het interview bleef de minister mopperen     .,50
 Hoe reageerde het andere team      .,50
 Over een half uur arriveert het vliegtuig uit Casablanca      .,50
 Vanaf perron vijf zal de internationale trein naar Parijs vertrekken     .,50
 Waarom gilde dat meisje      .,50
 Op mijn balkon blijft de zon schijnen     .,50
 Wanneer is zijn oma overleden     .,50
 Volgende week woensdag zullen alle docenten gaan demonstreren     .,50
 Geheel onverwacht stortte een deel van dat nieuwe gebouw  in    .,50
 Na zijn succesvolle campagne is de populariteit van de politicus toegenomen     .,50
 Straks zullen we uitrusten     .,50
 Tijdens het politieonderzoek bleef de verdachte ontkennen     .,50
 Waarom moeten we uitstappen     .,50
 Over mijn favoriete stad heeft die Vlaamse zanger gezongen     .,50
 Hoe laat moeten we beginnen     .,50
 Ondanks de nederlaag bleef de schaatser glimlachen     .,50
 Wanneer vertrekt jouw trein      .,50
 Met ruim twee uur vertraging vertrok ons vliegtuig      .,50
 Waarom stoeien die jonge beertjes      .,50
 Tot wanneer is dat boek uitgeleend     .,50
 In onze tuin scharrelen tientallen kippen      .,50
 Het grootste gedeelte van de dag slaapt mijn jonge zusje      .,50
 Hoe heeft hij gespiekt     .,50
 Tot mijn veertiende heb ik gestotterd     .,50
 Vlak voor haar negentigste verjaardag is mijn oma gestorven     .,50
 In welk land zou je willen wonen     .,50
 Uit welk land komt die bekende marathonloper      .,50
 Hoe zijn de gevangenen ontsnapt     .,50
 Tijdens de herfststorm is mijn kleine bootje gezonken     .,50
 Hoe lang heb ik geslapen     .,50
 Na de zware operatie moest de vermoeide chirurg pauzeren     .,50
 Gisteren ben ik gevallen     .,50
 Op het gladde veld zijn veel hockeyers uitgegleden     .,50
 Tijdens de noodlanding hebben de passagiers gegild     .,50
 Na de gemiste penalty mopperde de ontevreden coach      .,50
 Door de economische crisis is de werkloosheid gestegen     .,50
 Volgens de thermometer is mijn koorts gedaald     .,50
 In de wasmachine is mijn favoriete shirt verkleurd     .,50
 Morgen zullen alle brandweermannen gaan staken     .,50
 Door het vele wassen is mijn broek verkleurd     .,50
 In Amsterdam is zij gaan studeren     .,50
 Na drie maanden kunnen baby's glimlachen     .,50
 Is de penalty door de aanvoerder gemist     .,51
 Is de lekkage door de loodgieter verholpen     .,51
 Is het Wit-Russsische regeringsgebouw door woedende demonstranten bezet     .,51
 Is de tombe van de Farao door een Engelse archeoloog opgegraven     .,51
 Werden zijn provocerende opmerkingen door de politieagent genegeerd     .,51
 Werd het gips door de assistent van de dokter verwijderd     .,51
 Is die gruwelijke misdaad door de recherche opgelost     .,51
 Zijn haar kostbare sieraden door haar dochters verkocht     .,51
 Worden de meeste files door kleine aanrijdingen veroorzaakt     .,51
 Was die onderzeeër door een torpedo gezonken     .,51
 Zijn die schapen door onze eigen slager geslacht     .,51
 Is dat historische pand door de uitslaande brand verwoest     .,51
 Zijn die bijzondere speerpunten door die boer gevonden     .,51
 Is zijn enkel door de beste chirurg van Nederland geopereerd     .,51
 Zijn die moeilijke sommen door de leraar uitgelegd     .,51
 Zijn jouw kiezen door jouw oudere broer getrokken     .,51
 Wordt de post door die vriendelijke jongeman bezorgd     .,51
 Is zijn contract door de directeur verlengd     .,51
 Is die kansloze nederlaag van het Nederlands elftal door de oud-bondscoach voorspeld     .,51
 Is het dagboek van Anne Frank door die regisseur verfilmd     .,51
 Waren de verkeerde bomen door het hoveniersbedrijf gekapt     .,51
 Zijn de  verdachten door de politieagent gearresteerd     .,51
 Is het verrassingsfeestje voor jouw oma door jullie georganiseerd     .,51
 Zijn de boeken van de bibliotheek door jouw vader teruggebracht     .,51
 Worden talloze bedreigde diersoorten door verschillende natuurorganisaties beschermd     .,51
 Zijn de juiste antwoorden van de leestoets door de docent besproken     .,51
 Is het verdrietige kleutertje door haar lieve juf getroost     .,51
 Is dat eeuwenoude raadsel door die briljante student opgelost     .,51
 Is dat schip door een explosie in de machinekamer gezonken     .,51
 Zijn alle hechtingen door de arts verwijderd     .,51
 Is jullie bod door de verkopers geaccepteerd     .,51
 Werd de oudste inwoners van Tilburg door de burgemeester gefeliciteerd     .,51
 Zijn alle campinggasten door de Franse politie geëvacueerd     .,51
 Zijn de brutale overvallers door de beveiligingscamera gefilmd     .,51
 Werd de aangereden fietser door behulpzame omstanders geholpen     .,51
 Is de verdeling van de rijkdom in Nederland door het onderzoeksbureau beschreven     .,51
 Is de brandende frituurpan door jouw koelbloedige vriend geblust     .,51
 Is dat houten schuurtje door vandalen gesloopt     .,51
 Is de oorzaak van dat vliegtuigongeluk door technici onderzocht     .,51
 Werd die razendsnelle aanvaller door de arbitrage afgefloten     .,51
" Zijn deze overheelijke, bruine bolletjes door jou gebakken     .",51
 Zijn die schitterende portretfoto's door haar gemaakt     .,51
 Werden jullie paspoorten door vier verschillende douaniers gecontroleerd     .,51
 Werd de oude man door de ambulancebroeders gereanimeerd     .,51
 Werd de woordvoerder van de directie door de boze demonstranten bekogeld     .,51
 Is de ontsnapte leeuw door de plaatselijke politie gedood     .,51
 Is de gehaaide oplichter door de misdaadjournalist ontmaskerd     .,51
 Worden alle reizigers naar Suriname door de douaniers gefouilleerd     .,51
 Is het pasgeboren babyolifantje door haar moeder verstoten     .,51
 Is het zebrajong door een hongerige leeuwin gedood     .,51
 Is de marathon van Rotterdam door die Ethiopische hardloper gewonnen     .,51
 Zijn de lucifers door een Hongaarse man uitgevonden     .,51
 Zijn de Amerikaanse verkiezingen door de zittende president gewonnen     .,51
 Is jouw broer door mijn opmerking gekwetst     .,51
 Wordt het kerstgala door de leerlingenraad georganiseerd     .,51
 Is het ontslag van de minister van financiën door de minister-president bevestigd     .,51
 Is jouw bril door de opticien gerepareerd     .,51
 Zijn deze bijzondere wandtekeningen door neanderthalers gemaakt     .,51
 Zal jouw werkstuk door die strenge docente beoordeeld worden     .,51
 Werd de winnares van de Olympische fietsfinale door de koning gefeliciteerd     .,51
 Is de ontslagen minister door de kritische journalist geïnterviewd     .,51
 Is de drenkeling door alerte surfers gered     .,51
 Is de keukenbrand door de bewoners geblust     .,51
 Wordt jouw favoriete voetbalclub door een Russisch bedrijf gesponsord     .,51
 Werd de late gelijkmaker door de twijfelende scheidsrechter afgekeurd     .,51
 Werd de vertraging door de stationschef omgeroepen     .,51
 Zijn alle badgasten door de strandwachten gewaarschuwd     .,51
 Zijn alle muggen door jouw vader gedood     .,51
 Werd de uitzinnige menigte door het Canadese tieneridool toegesproken     .,51
 Is haar trouwjurk door die bekende Italiaanse ontwerpster gemaakt     .,51
 Is dat museum voor moderne kunst in Bilbao door een bekende architect ontworpen     .,51
 Is die ingezonden brief door jouw zus geschreven     .,51
 Wordt de nieuwe keuken door gespecialiseerde monteurs geïnstalleerd     .,51
 Is het geschrokken meisje door haar bezorgde vader getroost     .,51
 Werd de hele wijk door de politie en de brandweer geëvacueerd     .,51
 Is het verkiezingsdebat tussen de twee Amerikaanse presidentskandidaten door meer dan honderd miljoen mensen bekeken     .,51
 Zijn de overvallers door de omstanders gefilmd     .,51
 Is onze geheime boomhut door de boze boswachter afgebroken     .,51
 Is die prachtige stoel door jou ontworpen     .,51
 Werd de blinde vrouw door het winkelpersoneel geholpen     .,51
 Werd de nieuwe middenvelder van Juventus door de trotse voorzitter gepresenteerd     .,51
 Werd de boomlange Amerikaanse basketballer door de journalist geïnterviewd     .,51
 Zijn alle kippen door de marter gedood     .,51
 Werd de politie door het winkelpersoneel gebeld     .,51
 Is de finale van het songfestival door zestig miljoen mensen bekeken     .,51
 Is het nieuwe concertgebouw door de koningin geopend     .,51
 Is de gruwelijke moord door de recherche opgelost     .,51
 Zijn onze bouwplannen door de gemeente goedgekeurd     .,51
 Zijn de kwetsende spreekkoren door de scheidsrechter genegeerd     .,51
 Is het negatieve reisadvies door die eigenwijze toeristen genegeerd     .,51
 Werd de bevrijde gijzelaar door de internationale pers ondervraagd     .,51
 Is de aanvaller van Zwolle door de tuchtcommissie geschorst     .,51
 Is het einde van de wereld door de Maya's voorspeld     .,51
 Zijn jouw moedervlekken door de huisarts verwijderd     .,51
 Is de dodo door de Nederlanders uitgeroeid     .,51
 Is de pijn in je schouder door die zware pijnstillers afgenomen     .,51
 Werd het Nederlandse containerschip door de Somalische piraten aangevallen     .,51
 Is de prijs van groente en fruit door de supermarkt verlaagd     .,51
" Is de zeer zeldzame, witte neushoorn door de natuurfotograaf gefotografeerd     .",51
 Werd de Olympisch kampioene door de burgemeester van haar geboortedorp gehuldigd     .,51
 Heeft de voetballer na de wedstrijd op de beslissingen van de scheidsrechter afgegeven    .,52
 Heeft de docent tijdens de les op het drukke rooster afgegeven    .,52
 Heeft de marathonloper tijdens de persconferentie op het hobbelige parcours afgegeven    .,52
 Gaf de automobilist bij de winkelbediende op de stijgende benzineprijzen  af   .,52
 Is de helikopterpiloot door het stormachtige weer van zijn geplande route afgeweken    .,52
 Wijken zijn onderzoeksresultaten op een aantal punten van zijn verwachtingen  af   .,52
 Wijkt de vervalsing op een aantal punten van het origineel  af   .,52
 Zal de onervaren verdediger goed op de schijnbewegingen van de aanvaller anticiperen    .,52
 Ben jij al aan dat nieuwe boek begonnen    .,52
 Zijn onze buren vandaag aan de verbouwing van hun huis begonnen    .,52
 Willen jouw klasgenoten niet aan dat schaatstoernooi deelnemen    .,52
 Wilde de titelverdediger ondanks zijn blessure aan de Olympische Spelen deelnemen    .,52
 Kan de skiër volgens de fysiotherapeuten aan de eerste twee wedstrijden van het seizoen deelnemen    .,52
 Kan de tennisser dankzij zijn vlotte revalidatie aan dat belangrijke toernooi deelnemen    .,52
 Wil jouw zusje echt aan een kookwedstrijd deelnemen    .,52
 Denk je ook aan jouw ouders     .,52
 Heb je ooit aan de gevolgen van jouw pestgedrag gedacht    .,52
 Hebben jullie lekker van de vrije middag genoten    .,52
 Geniet je wel van jouw welverdiende vakantie     .,52
 Genoot de pyromaan stiekem van alle media-aandacht     .,52
 Houdt jouw kat niet van aandacht     .,52
 Hopen de supporters ondanks de slechte vooruitzichten op een snelle rentree van de vedette     .,52
 Hoopt de organisatie van de marathon stiekem op een nieuw wereldrecord     .,52
 Had je misschien op een betere afloop gehoopt    .,52
 Heb jij nooit van zoetigheid gehouden    .,52
 Houden buitenlandse toeristen vooral van de typisch Nederlandse grachten     .,52
 Heeft de oude actrice nooit van media-aandacht gehouden    .,52
 Ging de directeur van het schoonmaakbedrijf niet op de vragen van het bezorgde personeel  in   .,52
 Ging de Amerikaanse wielrenner eindelijk op de beschuldiging van dopinggebruik  in   .,52
 Kunnen de leden van het wereldnatuurfonds via de website naar de broedende ooievaar kijken    .,52
 Wilden alle kinderen na het blije bericht naar het pasgeboren girafje kijken    .,52
 Lijdt jouw vader sinds kort aan diabetes     .,52
 Lijden veel kinderen uit derdewereldlanden door een gebrek aan schoon drinkwater aan besmettelijke ziektes     .,52
 Lijdt de helft van de Amerikanen inmiddels aan vetzucht     .,52
 Luistert de dirigent graag naar het werk van die onbekende componist     .,52
 Hebben jullie niet naar zijn uitleg geluisterd    .,52
 Hebben de gespannen militairen goed naar de uitleg van hun sergeant geluisterd    .,52
 Heb je goed naar het commentaar van de tandarts geluisterd    .,52
 Heb je nog over mijn voorstel nagedacht    .,52
 Reageerden de buitenlandse ministers positief op het voorstel van de Deense president     .,52
 Reageerde ik te laat op zijn aantrekkelijke voorstel     .,52
 Heeft de voetballer cynisch op de waarschuwing van de scheidsrechter gereageerd    .,52
 Kunnen wij echt op jullie steun rekenen    .,52
 Had de zieke actrice ooit op zoveel steunbetuigingen durven rekenen    .,52
 Hadden de kiezers na de belofte van de minister-president op lagere belastingen gerekend    .,52
 Rekenden de ziekenhuizen door de hittegolf op meer patiënten met een zonnesteek     .,52
 Rekent de woordvoerder van het asiel door de naderende zomervakantie op meer achtergelaten dieren     .,52
 Had de wegenwacht door de aanhoudende vorst op meer kleine aanrijdingen gerekend    .,52
 Twijfelden de supporters echt aan de kwaliteiten van die ervaren coach     .,52
