 Is de eeuwenoude toren ingestort      .,16
 Kraakt de stem van de oude man       .,16
 Hebben de deelnemers aan de avondvierdaagse geklaagd      .,16
 Ritselt de krant       .,16
 Heeft de kat gebeten      .,16
 Zijn jouw vakantieplannen veranderd      .,16
 Ben je ontslagen      .,16
 Is het volkslied afgelopen      .,16
 Heeft jouw vader gekookt      .,16
 Zijn de tomatenplantjes gegroeid      .,16
 Is de populariteit van de minister-president gedaald      .,16
 Is de prijs van benzine gestegen      .,16
 Is je favoriete jurkje gekrompen      .,16
 Is de kritiek toegenomen      .,16
 Is het peperdure cruiseschip gestrand      .,16
 Koken de aardappelen       .,16
 Is het ijsje gesmolten      .,16
 Zijn die gevaarlijke criminelen ontsnapt      .,16
 Hebben de bezoekers van de nieuwe James Bondfilm genoten      .,16
 Glimlacht het meisje       .,16
 Heeft het kritische publiek gelachen      .,16
 Heeft de politicus gefaald      .,16
 Is de toestand van de zieke president verbeterd      .,16
 Is de televisie-uitzending onderbroken      .,16
 Is de trein vertraagd      .,16
 Streeft het museum naar een hoger bezoeksaantal      .,17
 Verlangen de leerlingen van basisschool Het wespennest naar de vakantie      .,17
 Klagen de docenten over de kleine lokalen      .,17
 Vertrouwen de ouders op de diagnose van de arts      .,17
 Snakken de uitgedroogde planten naar een beetje water      .,17
 Hebben de musicalsterren voor een spectaculaire show gezorgd     .,17
 Heeft de politie naar de gestolen auto's gezocht     .,17
 Heeft de studente Frans aan haar uitspraak gewerkt     .,17
 Heeft de brandweer op duidelijkere vluchtroutes aangedrongen     .,17
 Heeft het elftal op het vertrek van de coach aangedrongen     .,17
 Heeft de secretaresse op haar baas afgegeven     .,17
 Wijken mijn bloedwaardes van het normale niveau  af    .,17
 Anticipeert de internationale onderneming op een mogelijke schadeclaim      .,17
 Neemt het Nederlandse estafetteteam aan de Olympische finale  deel    .,17
 Genieten jullie van dit stralende zomerweer      .,17
 Hoopt de debuterende schrijver op positieve recensies      .,17
 Houden huisdieren van hun baasjes      .,17
 Gaat de ontwerper op het aanbod van de koffiefabrikant  in    .,17
 Kijkt de architect naar mijn ontwerp      .,17
 Gaat de acteur op de kritische vragen van de journalist  in    .,17
 Hoopt de bevolking op nieuwe verkiezingen      .,17
 Hebben de bewoners van het bejaardentehuis van het uitstapje genoten     .,17
 Vreest de organisator van het festival voor koud en regenachtig weer      .,17
 Heeft hij naar de gezondheid van zijn oma geïnformeerd     .,17
 Heeft de Hongaarse zwemmer van zijn Poolse concurrent gewonnen     .,17
 Hebben de wielrenners voor de gladde wegen uitgekeken     .,17
 Is de kat van het onweer geschrokken     .,17
 Rekent de Amerikaanse president op een nieuwe verkiezingsoverwinning      .,17
 Reageerde de automobilist op de aanwijzingen van de politieagent      .,17
 Heeft de machinist op de andere trein gewacht     .,17
 Hebben de kinderen naar bijzondere schelpen gezocht     .,17
 Heeft de kok voor een lekker dessert gezorgd     .,17
 Snakken de wielrenners naar een vlakke etappe      .,17
 Heeft de campagneleider op een goede afloop vertrouwd     .,17
 Hebben de buurtbewoners over de rondhangende jeugd geklaagd     .,17
 Verlangt u naar het weekend      .,17
 Streeft ons bedrijf naar een betere dienstverlening      .,17
 Geeft de trambestuurder op de onbeschofte reizigers af     .,17
 Is de atleet aan een extra zware trainingsweek begonnen     .,17
 Heeft de burgemeester aan de schaatswedstrijd deelgenomen     .,17
 Hoopt de patiënt op een nieuwe nier      .,17
 Houden buitenlandse toeristen van Nederlandse snoepjes      .,17
 Is de schrijver op de vragen van het publiek ingegaan     .,17
 Heeft de dierenarts naar het zieke egeltje gekeken     .,17
 Lijdt de verwarde man aan waanideeën      .,17
 Heb je naar jouw moeder geluisterd     .,17
 Heeft hij over mijn voorstel nagedacht     .,17
 Hebben de internationale deskundigen over het welzijn van proefdieren gesproken     .,17
 Hebben de dolfijnen op het fluitsignaal van hun verzorger gereageerd     .,17
 Rekent de schooldirectie op de steun van de ouders      .,17
 Ruziën de buurlanden over het grensgebied      .,17
 Zijn de balletdansers van hun nieuwe choreografie geschrokken     .,17
 Twijfelde de windsurfer aan de weersvoorspelling      .,17
 Kijken die toeristen voor behendige zakkenrollers  uit    .,17
 Heeft de nationale honkbalploeg van dat amateurteam verloren     .,17
 Heeft de bezoeker van het restaurant naar het recept gevraagd     .,17
 Vreest de computerwinkel voor een daling van de omzet      .,17
 Wachtte de kudde olifanten op het achtergebleven jong      .,17
 Wijst de politicus op de gevaren van het internet      .,17
 Zoekt de archeoloog naar onontdekte graftombes      .,17
 Snakken de leerlingen naar de grote pauze      .,17
 Klagen de automobilisten over de hoge benzineprijzen      .,17
 Heeft de politieke partij op strengere verkeerscontroles aangedrongen     .,17
 Reageerde de zangeres op de beschuldigingen  van haar platenmaatschappij      .,17
 Wijken de resultaten van de verwachtingen  af    .,17
 Heeft die populaire jongensband aan het benefietconcert deelgenomen     .,17
 Genoot de oude zanger van de massale aandacht      .,17
 Hoopt de ambitieuze studente op een studiebeurs      .,17
 Klaagt de chirurg over de werkdruk      .,17
 Klagen de campinggasten over de slechte sanitaire voorzieningen      .,17
 Vertrouwt het Britse koningshuis op de steun van het volk      .,17
 Zoekt de klassenleraar naar een oplossing voor het probleem      .,17
 Heeft het vliegtuig op de overstappende reizigers gewacht     .,17
 Hebben je collega's over de voetbalwedstrijd gesproken     .,17
 Heb je over mijn voorstel nagedacht     .,17
 Luisteren de studenten naar de uitleg van de wetenschapper      .,17
 Heeft Marieke naar de brochure gekeken     .,17
 Hoopt de jongste deelnemer van de danswedstrijd op de eerste prijs      .,17
 Hebben de wandelaars van de mooie natuur genoten     .,17
 Vreest de bevolking van het arme land voor een burgeroorlog      .,17
 Moeten de reizigers naar Utrecht voor een lange vertraging vrezen     .,17
 Vrezen de economen voor een afname van de economische groei      .,17
 Streeft de leerling naar betere cijfers      .,17
 Klaagt de wijnboer over de slechte oogst      .,17
 Verlangen de leerlingen naar de zomer      .,17
 Zorgt de nachtzuster voor de gezondheid van de patiënten      .,17
 Zijn de meisjes van de luide knal geschrokken     .,17
 Is het kleine jongetje van de grote hond geschrokken     .,17
 Vreest de coach van de voetballer voor een zware blessure      .,17
 Twijfelt het meisje met de dreadlocks over een nieuw kapsel      .,17
 Twijfelt de scholier over zijn vervolgopleiding      .,17
 Hebben de bergbeklimmers voor loszittende rotsen uitgekeken     .,17
 Speelde jij met Lego      .,17
 Hebben jullie met Lego gespeeld     .,17
 Streeft de topsporter naar een Olympische medaille      .,17
 Hebben de klassenvertegenwoordigers aan het schooldebat deelgenomen     .,17
 Heeft jouw favoriete handbalteam van de hekkensluiter verloren     .,17
 Vraagt die nieuwe werknemer om een beter salaris      .,17
 Rekent de bondscoach van het Nederlands elftal op een ruime overwinning      .,17
 Luister je naar mij      .,17
 Heb je vallende sterren gezien     .,18
 Heeft de staatssecretaris van onderwijs de bezuinigingen doorgevoerd     .,18
 Moeten Jeroen en Lucas een presentatie houden     .,18
 Hebben de eksters een nieuw nest gebouwd     .,18
 Kan je de vuilnisbak verplaatsen     .,18
 Kunnen jullie het volkslied meezingen     .,18
 Mogen de bezoekers van het bos een kampvuurtje maken     .,18
 Heeft de directeur van jullie school een toespraak gehouden     .,18
 Kreeg de bikkelharde verdediger geen gele kaart      .,18
 Hebben jouw leerlingen goede resultaten behaald     .,18
 Heeft de fotograaf mooie foto's van het natuurgebied gemaakt     .,18
 Gaat zij die jurk kopen     .,18
 Heeft de wilde beer haar jonkies beschermd     .,18
 Kan jij de tafel van dertien opzeggen     .,18
 Heeft de astronaut een foto van de aarde gemaakt     .,18
 Behaalde Epke Zonderland Olympisch goud      .,18
 Heeft de storm het dak van je huis verwoest     .,18
 Begrijp je de Nederlandse spellingsregels      .,18
 Heeft de hagelbui de fruitbomen beschadigd     .,18
 Testte de arts je reflexen      .,18
 Erkende de leraar zijn fout      .,18
 Heeft jullie docent de opdracht uitgelegd     .,18
 Verdient de bondscoach van het Nederlands elftal een goed salaris      .,18
 Vond het wilde zwijn een paar paddenstoelen      .,18
 Had de kapitein van het cruiseschip een andere beslissing moeten nemen     .,18
 Heeft de kaakchirug jouw verstandskiezen getrokken     .,18
 Probeerde hij mij te bellen     .,18
 Probeerde zij ons te helpen     .,18
 Zal ik hen uitnodigen     .,18
 Heeft de uitvinder een gat in de markt gevonden     .,18
 Heeft de baas ons ontslagen     .,18
 Heeft jouw dokter deze brief geschreven     .,18
 Bespeelt jullie dochter een instrument      .,18
 Herkennen apen hun spiegelbeeld      .,18
 Heeft de verslaggever zijn fout toegegeven     .,18
 Heeft de keeper de penalty gestopt     .,18
 Bevat deze taart veel suiker      .,18
 Toonde de baby haar schitterende glimlach      .,18
 Nam de scheidsrechter de overtreding  waar    .,18
 Heeft de sponsorloop voor het goede doel veel geld opgeleverd     .,18
 Lezen jouw ouders de krant      .,18
 Heeft de krantenjongen de krant bezorgd     .,18
 Heeft de moeder haar dochtertje aangekleed     .,18
 Heeft zijn zus haar idool ontmoet     .,18
 Heeft de glazenwasser een ruit gebroken     .,18
 Bewonderde de klas het schilderij van Van Gogh      .,18
 Heeft de boer zijn veld omgeploegd     .,18
 Heeft de bekende schilder de koning en zijn gezin geschilderd     .,18
 Bereikte de vermoeide marathonloper de finish      .,18
 Bereikten de bergbeklimmers de top van de Mount Everest      .,18
 Ben je jouw portemonnee verloren     .,18
 Heb jij dit spannende verhaal geschreven     .,18
 Heeft u mijn reservering ontvangen     .,18
 Heeft de assistent van de chef-kok dit heerlijke gerecht bereid     .,18
 Nam de conciërge de telefoon  op    .,18
 Zochten de konijnen een veilige plek      .,18
 Heb jij je enkel gebroken     .,18
 Leverde zijn moeder zijn schoolboeken in     .,18
 Wil je een ander kapsel proberen     .,18
 Heeft de arts het gips verwijderd     .,18
 Mag ik je vulpen gebruiken     .,18
 Heeft het Nederlands Elftal de finale verloren     .,18
 Is de treinreiziger zijn kaartje verloren     .,18
 Schreef de verslaggever een zeer kritisch artikel      .,18
 Hebben de vuilnismannen het afval opgehaald     .,18
 Ontvangen de gedupeerde reizigers een vergoeding      .,18
 Is hij zijn telefoonnummer vergeten     .,18
 Heeft de directeur van het hotel zijn excuses aangeboden     .,18
 Heeft de monteur de accu vervangen     .,18
 Speelde het Concertgebouworkest de vijfde symfonie van Beethoven      .,18
 Had de weerman dit slechte weer voorspeld     .,18
 Heeft de reisgids juiste informatie verschaft     .,18
 Verzamelen jullie oude postzegels      .,18
 Zoekt de schrijver nieuwe inspiratie      .,18
 Heeft jullie hond een schoonheidswedstrijd gewonnen     .,18
 Kan je me helpen     .,18
 Heeft de brandweer het vuur geblust     .,18
 Begrijpt een hond de emoties van zijn baas      .,18
 Heeft de ober de koude drankjes gebracht     .,18
 Bakt oma de lekkerste appeltaart van de wereld      .,18
 Bezoeken José en Michiel alle continenten van de wereld      .,18
 Heeft de archeoloog een nieuwe piramide ontdekt     .,18
 Waarderen de toeristen het museum van Dali      .,18
 Heeft koningin Maxima een mooie glimlach      .,18
 Heeft het voetbalteam een zware training gehad     .,18
 Heeft de buurvrouw een boze e-mail gestuurd     .,18
 Imiteerden de Romeinen de Grieken      .,18
 Heeft de wildplasser een boete gekregen     .,18
 Zal het nieuwe kabinet een akkoord bereiken     .,18
 Heeft de dirigent een daverend applaus ontvangen     .,18
 Vertelt de geschiedenisleraar zulke mooie verhalen      .,18
 Betoverde de danseres van de balletacademie het publiek      .,18
 Zullen de meeste Nederlanders hun stem uitbrengen     .,18
 Rookten de rivaliserende indianenstammen de vredespijp      .,18
 Ontdekte de archeoloog een peperdure schat      .,18
 Hebben de pupillen het toernooitje gewonnen     .,18
 Mag een krant gruwelijke foto's publiceren     .,18
 Mogen kinderen van zestien jaar hun rijbewijs halen     .,18
 Heeft de politie de gevaarlijke crimineel gevangen     .,18
 Zal Apple een nieuw product ontwikkelen     .,18
 Bestormden de boze bevolking de Bastille      .,18
 Heeft je vader jouw boterhammen gesmeerd     .,18
 Doopt de dominee het kindje      .,18
 Vond de grafrover de sieraden van de oude koning      .,18
 Sneed Vincent van Gogh zijn oor  af    .,18
 Sneed de chirurg de buik van de patiënt  open    .,18
 Moesten de leerlingen een kikker ontleden     .,18
 Tekenden de nieuwe huiseigenaren het koopcontract      .,18
 Overhoorde de moeder haar dochters      .,18
 Heeft hij zich bezeerd     .,18
 Heeft zij zich verontschuldigd     .,18
 Heb jij je voorgesteld     .,18
 Heeft u zich vermaakt     .,18
 Hebben jullie je aangemeld     .,18
 Heb ik me verslapen     .,18
 Heeft de bendeleider zich overgegeven     .,18
 Moet iedereen zich legitimeren     .,18
 Hebben de kinderen zich verslapen     .,18
 Hadden alle docenten zich verkleed     .,18
 Hadden de inbrekers zich verstopt     .,18
 Moet jij je legitimeren     .,18
 Heeft de vijand zich overgegeven     .,18
 Heb ik me misdragen     .,18
 Heeft de ruiter zich bezeerd     .,18
 Stelde de aanvaller van Real Madrid zich  aan    .,18
 Hadden de overvallers zich vermomd     .,18
 Moesten we ons inschrijven     .,18
 Moeten we ons legitimeren     .,18
 Heeft u zich verslapen     .,18
 Hebben ze zich verveeld     .,18
 Waren de hotelovernachtingen duur      .,19
 Waren de kinderen heel erg verlegen      .,19
 Is het leven van een topsporter zwaar      .,19
 Is Frits geloofwaardig      .,19
 Is het meubilair van mijn grootouders ouderwets      .,19
 Is de wonderdokter een oplichter gebleken     .,19
 Waren die paddenstoelen giftig      .,19
 Is die chirurg bekwaam      .,19
 Wordt het Nederlands elftal wereldkampioen      .,19
 Waren de dure bijlessen nuttig      .,19
 Lijkt de spits dikker te zijn geworden     .,19
 Bleek het gedumpte afval gevaarlijk te zijn     .,19
 Was de behandeling succesvol      .,19
 Waren de leerlingen bang      .,19
 Is deze oefening te moeilijk      .,19
 Was het televisieprogramma een kijkcijferhit geworden     .,19
 Was de muziek te luid      .,19
 Bleek de burgemeester van Barcelona fan van Real Madrid te zijn     .,19
 Was de assistent van de dokter behulpzaam      .,19
 Is het schilderen van het plafond een tijdrovende klus      .,19
 Waren de jonge kinderen bang      .,19
 Is de nieuwe behandelmethode een succes      .,19
 Zullen Anne en Marieke goede vrienden worden     .,19
 Zal de nieuwe directeur een aardige man zijn     .,19
 Is een broodje kroket zijn favoriete snack      .,19
 Zal haar dochter een bekende actrice worden     .,19
 Wil de coach landskampioen worden     .,19
 Zullen deze studenten de topwetenschappers van de toekomst worden     .,19
 Zal de prijs van benzine hoger worden     .,19
 Zullen de resultaten van de toets beter worden     .,19
 Is voetbal de populairste sport van Nederland      .,19
 Was de vergadering snel en efficiënt      .,19
 Is Nederland een populaire vakantiebestemming      .,19
 Zal dat ijverige meisje een goede advocate worden     .,19
 Zullen de leerlingen van de sportklas topsporters worden     .,19
 Was de film een beetje saai      .,19
 Is de nieuwe lichting brugklassers leergierig      .,19
 Blijkt die snack een gevaar voor de volksgezondheid te zijn     .,19
 Zijn die voormalige rivalen vrienden geworden     .,19
 Is die jonge zanger heel populair      .,19
 Was Mariam zijn favoriete oppas      .,19
 Is Arthur een bekende schrijver geworden     .,19
 Is de renovatie van het oude schoolgebouw een langdurig proces      .,19
 Blijft Frankrijk zijn favoriete vakantieland      .,19
 Zal de reparatie van mijn auto een dure aangelegenheid zijn     .,19
 Is het water in het zwembad smerig      .,19
 Bleek het dure schilderij een vervalsing te zijn     .,19
 Is die kritische journalist een tegenstander van de premier geworden     .,19
 Blijkt de invaller voor wiskunde streng te zijn     .,19
 Is de arrestant gewelddadig geworden     .,19
 Zal de drukste jongen van de school rustiger worden     .,19
 Zullen de leerlingen van de chaotische docent onrustig blijven     .,19
 Zal de enthousiaste tekenaar een goede schilder worden     .,19
 Is de sfeer prettig      .,19
 Is de uitkomst van de som duidelijk      .,19
 Is de uitkomst van het ziekenhuisonderzoek geruststellend      .,19
 Blijkt jullie nieuwe mentor kritisch te zijn     .,19
 Is zij grappig      .,19
 Is hij de meest ervaren kandidaat      .,19
 Is het rode team de winnaar      .,19
 Blijkt de handtekening op het rapport vals te zijn     .,19
 Heet de jongen met de rode tas Marco      .,19
 Heten de kinderen van jouw broer Jip en Pim      .,19
 Is het wachtwoord van jouw e-mailadres veilig      .,19
 Wordt de prijs van biologisch vlees hoger      .,19
 Willen jullie architect worden     .,19
 Zijn de uitslagen van het onderzoek positief      .,19
 Is de geschorste atleet erg teleurgesteld      .,19
 Is de vader van Marco een bekende voetballer      .,19
 Zijn de plannen van de minister gunstig      .,19
 Is die wereldberoemde fotograaf een vriendelijke man      .,19
 Zijn honden trouwe dieren      .,19
 Is onze nieuwe collega charmant en enthousiast      .,19
 Heet de vedette van het Portugese voetbal Cristiano Ronaldo      .,19
 Is zijn vervelende gedrag beter geworden     .,19
 Is de Nederlandse grammatica erg moeilijk      .,19
 Blijken miereneters zeer intelligente dieren te zijn     .,19
 Is het zieke konijntje beter geworden     .,19
 Zou het dragen van een veiligheidshelm een oplossing kunnen zijn     .,19
 Zou jij astronaut willen worden     .,19
 Zal de jonge ondernemer succesvol worden     .,19
 Zal de temperatuur van het zeewater hoger worden     .,19
 Is jullie schoolreisje naar Disneyland een leuk uitstapje geworden     .,19
 Was het bezoek aan de Engelse graaf een groot succes geworden     .,19
 Is jouw buurman heel handig      .,19
 Is jullie klassenleraar geduldig      .,19
 Was jouw eerste liefde het zusje van mijn beste vriend      .,19
 Blijkt haar huisgenote irritant te zijn     .,19
 Was de kookcursus een goede investering      .,19
 Kunnen robots slimmer worden     .,19
 Is die kleine operatie veilig      .,19
 Wilde die bekende toneelspeler operazanger worden     .,19
 Wil hij rijk worden     .,19
 Was de analyse van de sportverslaggever duidelijk      .,19
 Waren de resultaten van de handbalploeg verrassend      .,19
 Blijken de leden van de punkband liefhebbers van klassieke muziek te zijn     .,19
 Was de nemer van de beslissende penalty heel zenuwachtig      .,19
 Was de scheidsrechter eerlijk      .,19
 Is een grafische rekenmachine een handig hulpmiddel      .,19
 Was de toespraak van de Olympisch kampioene ontroerend      .,19
 Is mijn boek een geschikt cadeau gebleken     .,19
 Schijnt de kust van Schotland woest te zijn     .,19
 Was het handschrift van de arts leesbaar      .,19
 Zijn fietshelmen veiliger geworden     .,19
 Zijn de klachten van de patiënt heftiger geworden     .,19
 Zijn profielensites populairder geworden     .,19
 Is jouw salaris hoger geworden     .,20
 Is de situatie in Afghanistan beter geworden     .,20
 Heeft de agente de automobilist een waarschuwing gegeven    .,20
 Gaf de trotse ruiter zijn paard een schouderklopje     .,20
 Zullen de ruziënde voetballers elkaar een hand geven    .,20
 Schenkt de herbergier zijn gasten een extra glaasje wijn  in   .,20
 Schonk de weduwe van Picasso het museum een kostbaar schilderij     .,20
 Schenkt de premier van Nederland zijn kapsel veel aandacht     .,20
 Heeft de biologische boer het restaurant het bestelde vlees geleverd    .,20
 Heeft de uitvaartondernemer de nabestaanden de urn met as overhandigd    .,20
 Heeft de huisarts de medisch specialist het patiëntendossier overhandigd    .,20
 Overhandigt de verkoopster de klant de tassen met nieuwe kleren     .,20
 Heeft de overleden man de stichting voor onderzoek naar kanker zijn hele fortuin nagelaten    .,20
 Liet de man zijn kleinkinderen niets  na   .,20
 Heeft de huurder de woningbouwvereniging de achterstallige huur betaald    .,20
 Heeft de op doping betrapte wielrenner de journalisten zwijggeld betaald    .,20
 Heeft Vincent van Gogh zijn broer Theo zijn eerste schilderij gekocht    .,20
 Heeft de gearresteerde crimineel zijn familie leugens verteld    .,20
 Heeft het gerenommeerde veilinghuis de anonieme bieder uit Zuid-Korea een bijzondere diamant verkocht    .,20
 Verkopen de stewardessen de passagiers drank en sigaretten     .,20
 Heb jij je vergeetachtige vriendin mijn dure halsketting geleend    .,20
 Wilde Thomas mij zijn aantekeningenboekje lenen    .,20
 Heeft de vader van het boze jongetje de buurman zijn excuses aangeboden    .,20
 Gunde het Nationale Ballet de oude danser de hoofdrol     .,20
 Heeft de bondscoach het jonge voetballertje zijn internationale debuut gegund    .,20
 Heeft de sympathieke man mijn moeder haar sleutels ontfutseld    .,20
 Heeft de afdelingsleider de nieuwe brugklassers de schoolregels meegedeeld    .,20
 Heeft de directeur van het ziekenhuis zijn personeel een beter salaris beloofd    .,20
 Heeft de verkoper de eigenaar van de Porsche een goede verzekering aangeraden    .,20
 Heeft de reisorganisatie de avontuurlijke vrienden een goed muskietennet aangeraden    .,20
 Kan de chef-kok ons een bepaald gerecht aanbevelen    .,20
 Heeft de bezorgde dokter jouw vader een gezondere levensstijl aangeraden    .,20
 Heeft de onderzeeër de marinebasis een sos-signaal gestuurd    .,20
 Stuurde de geheime aanbidder de nieuwsgierige vrouw rozen en chocola     .,20
 Stuurt de ontdekkingsreiziger zijn familie foto's van onontdekte diersoorten     .,20
 Stuurde de architect de kritische opdrachtgevers zijn tekeningen voor het nieuwe winkelcentrum     .,20
 Heeft de opticien de slechtziende man een sterkere bril gegeven    .,20
 Probeerde de bezoeker van Artis de leeuwen oud brood te geven    .,20
 Schenkt de organisator het kindertehuis in Malawi de opbrengst van het benefietconcert     .,20
 Heeft de wereldreiziger zijn gezin deze onbekende ziekte overgedragen    .,20
 Heeft de wetenschapper aan voldoende mensen zijn kennis overgedragen    .,20
 Moeten de Chinese toeristen de douaniers hun paspoort overhandigen    .,20
 Heeft de boekhandelaar de verzamelaar de eerste druk van de roman De avonden overhandigd    .,20
 Heeft de ongeliefde president de kritische televisiezender een grote som geld betaald    .,20
 Heeft de havik haar jongen een muis gegeven    .,20
 Heb je haar jouw camera geleend    .,20
 Heeft de straatverkoper haar rode rozen gegeven    .,20
 Heeft de bikkelharde verdediger de spits van Arsenal een scoringskans ontnomen    .,20
 Kan jij de buitenlandse toeristen een goedkoop restaurantje aanbevelen    .,20
 Heeft de goochelaar zijn publiek een onwaarschijnlijke truc beloofd    .,20
 Moest de vervelende leerling zijn biologiedocent een betere werkhouding beloven    .,20
 Wilde de zwemleraar de jonge kinderen de schoolslag leren    .,20
 Wilden de verontwaardigde buurtbewoners de burgemeester hun brief met klachten overhandigen    .,20
 Heeft de fysiotherapeut de geblesseerde handballer een maand rust aangeraden    .,20
 Stuurden de ouders hun kinderen lieve kaartjes     .,20
 Gaf de scheidsrechter de blonde aanvaller van PSV zijn tweede gele kaart     .,20
 Heeft het bijna verdronken jongetje zijn redder een dikke knuffel gegeven    .,20
 Heeft de jury de zeilers het startsignaal gegeven    .,20
 Heeft de Poolse douanier de reizigers hun paspoorten teruggegeven    .,20
 Gaf de arts de zwaargewonde patiënt een hartmassage     .,20
 Wilde het bruidsmeisje de bruidegom de zilveren ringen overhandigen    .,20
 Heeft de koningin de goudenmedaillewinnaars de koninklijke onderscheiding overhandigd    .,20
 Probeerde de malafide autohandelaar de oude vrouw een afgekeurde auto te verkopen    .,20
 Hebben de strandwachten de angstige zwemmer een reddingsvest gegeven    .,20
 Hebben de ontevreden gasten de ober een fooi gegeven    .,20
 Heeft de recensent de lezers van De Volkskrant het nieuwe boek van Dimitri Verhulst aangeraden    .,20
 Heeft de monteur de trotse bezitter van het volkswagenbusje het slechte nieuws verteld    .,20
 Heeft de kapper zijn klant de prijs voor een behandeling meegedeeld    .,20
 Heeft de student de hoogleraar de antwoorden van het tentamen ontfutseld    .,20
 Heeft het bijgelovige meisje de waarzegster haar toekomst gevraagd    .,20
 Heeft de arts zijn patiënten de verkeerde behandeling voorgeschreven    .,20
 Schrijft die clubarts de overbelaste sporter afslankpillen  voor   .,20
 Raadt de diëtiste jou een ander voedingspatroon  aan   .,20
 Heeft de leider van het scoutingkamp de kinderen een nieuwe knoop geleerd    .,20
 Heb je jouw advocaat een e-mail gestuurd    .,20
 Heeft hij aan de vriendelijke serveerster de rekening gevraagd    .,20
 Belooft de presidentskandidaat het volk economische voorspoed     .,20
 Schenkt de schatrijke softwareontwikkelaar de stichting twee miljoen dollar     .,20
 Schenkt de oppas de kinderen een glaasje melk  in   .,20
 Sturen de onderzoekers hun werkgevers updates van hun bevindingen     .,20
 Leert hij jullie veel nieuwe woorden     .,20
 Legt de docent Nederlands jullie het verschil tussen hen en hun  uit   .,20
 Raadt de wijnkenner de liefhebber van witte wijn deze fles  aan   .,20
