 De Nederlandse supporters juichten       .,1
 Mijn kleine zusje krijst       .,1
 De gymdocent  mopperde       .,1
 Onze buurman op de camping heeft gesnurkt      .,1
 De boze stier snuift       .,1
 De verdediger van Barcelona heeft gescoord      .,1
 Het vliegtuig daalt       .,1
 Mijn kleine neefje is gegroeid      .,1
 De trein naar Parijs is vertrokken      .,1
 Het vliegtuig van de koningin is geland      .,1
 De wegwerkers hebben gepauzeerd      .,1
 De ijsjes smelten       .,1
 De prijs van treinkaartjes is gestegen      .,1
 De deur van de slaapkamer klemt       .,1
 Het plannetje is mislukt      .,1
 Mijn stoel wiebelt       .,1
 De kinderen uit groep vier gaan zwemmen      .,1
 De oude vrouw is uitgegleden      .,1
 De campinggasten hebben geklaagd      .,1
 Mijn zusje zeurt       .,1
 Mijn kleine neefje stotterde       .,1
 De onderkoelde zwemmers bibberden       .,1
 De vermoeide zwemmers rusten  uit     .,1
 De enthousiaste kinderen hebben gezwaaid      .,1
 De gearresteerde man heeft gelogen      .,1
 Het publiek applaudisseerde       .,1
 De recordpoging is mislukt      .,1
 De gevangenen probeerden te ontsnappen      .,1
 De monumentale toren stortte  in     .,1
 De eindexamenkandidaat heeft afgekeken      .,1
 De rondvaartboot  is vertrokken      .,1
 Mijn rechterbeen jeukt       .,1
 De fans van het tieneridool gillen       .,1
 Deze twee zinnen rijmen       .,1
 Mijn beide grootouders hebben gewerkt      .,1
 De werknemers van het ziekenhuis hebben geluncht      .,1
 De teleurgestelde supporters balen       .,1
 De jonge vosjes stoeien       .,1
 De vrouw met het volle winkelmandje heeft voorgedrongen      .,1
 De conditietrainer heeft hardgelopen      .,1
 Mijn beste vriend gaat skiën      .,1
 De boze hond gromt       .,1
 Het paard van de springruiter heeft gegaloppeerd      .,1
 Ons mooie kampvuur is uitgegaan      .,1
 De winst van het bedrijf is gedaald      .,1
 Ik heb geoefend      .,1
 Het jonge kalfje is verdronken      .,1
 De muggen in mijn kamer zoemen       .,1
 Mijn favoriete band heeft opgetreden      .,1
 De krant van mijn vader ritselt       .,1
 De luide muziek is gestopt      .,1
 Mijn lievelingsbroek is versleten      .,1
 Het verlegen meisje heeft geknutseld      .,1
 De vastgevroren zwaan trilde       .,1
 De tevreden werknemer heeft gegrijnsd      .,1
 Het baby'tje glimlacht       .,1
 De ontevreden cafébaas moppert       .,1
 De motor van onze boot sputterde       .,1
 De marathonloper is gestruikeld      .,1
 De vermoeide atleten moesten uitrusten      .,1
 Het luxe cruiseschip is gezonken      .,1
 De gigantische vissersboot is vastgelopen      .,1
 Dat boek is uitgeleend      .,1
 De dodo is uitgestorven      .,1
 De planten op de vensterbank zijn uitgedroogd      .,1
 De buurvrouw van mijn oma is overleden      .,1
 De winnaar van de gouden medaille heeft gejuicht      .,1
 De roedel wolven huilt       .,1
 Mijn broertje en zusje hebben gehuild      .,1
 De traumahelikopter is opgestegen      .,1
 Het hypermoderne blusvliegtuigje is opgestegen      .,1
 De zon heeft geschenen      .,1
 De geïnteresseerde toeschouwers hebben geapplaudisseerd      .,1
 Mijn huiduitslag is verdwenen      .,1
 Het zeilbootje van mijn oom is gezonken      .,1
 Het papieren vliegtuigje zweeft       .,1
 De wereldberoemde violiste heeft opgetreden      .,1
 Onze trap kraakt       .,1
 Mijn zolderraampje klemt       .,1
 Het personeel van de reinigingsdienst heeft gestaakt      .,1
 De verontwaardigde basisschooldocenten hebben gedemonstreerd      .,1
 De windrichting is gedraaid      .,1
 De fruitbomen in onze tuin bloeien       .,1
 De spannende voetbalwedstrijd is afgelopen      .,1
 Sommige eindexamenkandidaten hadden gespiekt      .,1
 De veerpont naar Newcastle is vertrokken      .,1
 De debutant van Barcelona heeft gescoord      .,1
 De winst van het bedrijf is gestegen      .,1
 De prijs van goud is gestegen      .,1
 De hordeloper is gestruikeld      .,1
 De resultaten van het Braziliaanse volleybalteam  zijn tegengevallen      .,1
 De schade aan het gebouw viel  mee     .,1
 Onze kleindochter slaapt       .,1
 De fruitbomen zijn gegroeid      .,1
 De trambestuurders staken       .,1
 Mijn kleine neefje zeurt       .,1
 De deuren van de trein zijn gesloten      .,1
 De kinderen van mijn zus willen stoeien      .,1
 De meegereisde supporters baalden       .,1
 Het oude echtpaartje wandelt       .,1
 De onvermoeibare wielrenner fietst       .,1
 De marathonloper rende       .,1
 De weergaloze ballerina heeft gedanst      .,1
 De broer van mijn vriendin heeft gelogen      .,1
 Mijn oudste zus studeert       .,1
 De kat van de buren miauwt       .,1
 Mijn oma heeft gezwommen      .,1
 De geschiedenisjuf zeurt       .,1
 De pasgeboren baby huilt       .,1
 De jongens zullen spelen      .,1
 De prijs van zilver is gestegen      .,1
 Het vliegtuig daalt       .,1
 De leraren hebben vergaderd      .,1
 Het misselijke meisje heeft overgegeven      .,1
 Het krakkemikkige roeibootje zal zinken      .,1
 De vakantiegangers genieten       .,1
 De kangoeroe springt       .,1
 De reiziger is verdwaald      .,1
 Ik heb gewonnen      .,1
 Willemijn aait de hond van de buren      .,2
 Zij heeft het concert van haar favoriete band bezocht     .,2
 De aanhangers van de voetbalvereniging  hebben het clublied gezongen     .,2
 De sportvisser ving een schitterende forel      .,2
 Ingeborg kuste haar vriendje      .,2
 De vermoeide moeder heeft het kindje gevoerd     .,2
 De keeper van het Nederlands elftal stopte de penalty      .,2
 Ariani knuffelt haar moeder      .,2
 De ijverige bevers hebben een dam gebouwd     .,2
 De alerte strandwacht redde het leven van het meisje      .,2
 De uitzinnige menigte viert de verjaardag van de koning      .,2
 De parachutist bewondert het geweldige uitzicht      .,2
 Deze speciale crème kan rode vlekken genezen     .,2
 Rembrandt van Rhijn heeft De nachtwacht geschilderd     .,2
 Veel topsporters volgen een speciaal dieet      .,2
 De bruidegom negeerde het advies van zijn familie      .,2
 De wetenschapper deed een bijzondere ontdekking      .,2
 De bioloog ontdekte een nieuwe vissoort      .,2
 De medewerkers van de dierenambulance hebben de vastgevroren zwaan gered     .,2
 Henk Angenent heeft de laatste Elfstedentocht gewonnen     .,2
 De frisdrankverkoper maakt een enorme winst      .,2
 Annie M.G. Schmidt heeft mijn favoriete kinderboek geschreven     .,2
 De twee snorkelaars zagen een kleine haai      .,2
 Mario Balotelli scoorde het winnende doelpunt      .,2
 Ik herkende mijn neef uit Amerika      .,2
 De actievoerders hebben het gebouw van de regeringspartij bestormd     .,2
 De schrijfster promootte haar nieuwe boek      .,2
 De online jongerenkrant had twintigduizend abonnees      .,2
 Het uiltje at een muisje      .,2
 De marktkoopman verkocht handdoeken en zonnebrillen      .,2
 De verpleger verzorgde de wond van de patiënt      .,2
 De klassenleraar sprak de vervelende leerlingen  toe    .,2
 Sommige medicijnen hebben vervelende bijwerkingen      .,2
 De vandaal had het bushokje vernield     .,2
 Mijn vader heeft een nieuw kookboek gekocht     .,2
 Hoeveel kinderen hebben een eigen laptop      .,2
 Zonnebrandcrème beschermt je huid      .,2
 Mijn grootvader heeft zijn eigen huis gebouwd     .,2
 De leerlingen uit de tweede klas maakten hun huiswerk      .,2
 Het kleine kleutertje heeft een hobbelpaard gekregen     .,2
 Mijn konijn heeft het snoer van mijn oplader vernield     .,2
 De docent bedacht nieuwe oefenzinnen      .,2
 Het meisje heeft haar lesboek gesloten     .,2
 Mijn zus heeft haar rijbewijs gehaald     .,2
 De onvoorzichtige snowboarders veroorzaakten een lawine      .,2
 Het wereldnatuutfonds beschermt bijzondere dieren      .,2
 De waakhond beschermde het huis van zijn bazin      .,2
 De dochter van mijn zus heeft wilde leeuwen gevoerd     .,2
 De leeuwen vielen een jonge zebra  aan    .,2
 De jeugdige bende heeft een aantal winkels beroofd     .,2
 De opmerking van de minister-president veroorzaakten een nationale discussie      .,2
 Een zakenroller heeft mijn portemonnee gestolen     .,2
 Thijs en Nienke kweken hun eigen tomaten      .,2
 Airbags en gordels beschermen de bestuurder en passagiers van de auto      .,2
 De voetballer negeerde de preek van de scheidsrechter      .,2
 Ridder Tiuri en zijn vriend Piak beleefden allerlei spannende avonturen      .,2
 Veel sportliefhebbers verzamelen plaatje van bekende voetballers      .,2
 Drie miljoen Nederlanders bekeken de opening van de Olympische Spelen      .,2
 De drie vrienden hebben Boedapest en Bratislava bezocht     .,2
 De luide muziek verstoorde de nachtrust van de campinggasten      .,2
 De Olympische sporter kreeg de zilveren medaille overhandigd     .,2
 Deze jonge zangeres heeft een geweldige stem      .,2
 De ervaren docent verloor zijn geduld      .,2
 De winnares van de poëziewedstrijd heeft een publicatie in de krant gewonnen     .,2
 De pubers bestelden twee pizza's en een hamburger      .,2
 De barbecue van het Nederlandse echtpaar veroorzaakten een zeer grote bosbrand      .,2
 De fotograaf opende de tentoonstelling      .,2
 De grootouders verwisselden de namen van hun kleinkinderen      .,2
" De omvangrijke encyclopedie bevatte veel grafieken, tabellen en afbeeldingen      .",2
 De afdelingsleider besprak de eindexamenresultaten      .,2
 De bouwlieden pakten het gereedschap      .,2
 De scholier erkende zijn fout      .,2
 De ober liet de borden vallen     .,2
 De zeewind bracht een beetje verkoeling      .,2
 Alle mensen op het strand zagen de spelende dolfijnen      .,2
 Het strand trekt miljoenen bezoekers      .,2
 Experts van de universiteit hebben de waarde van het schilderij getaxeerd     .,2
 De ontsnapte gevangene had een lange tunnel gegraven     .,2
 De ouders wilden het huiswerk controleren     .,2
 Veel bezoekers van de bloemenmarkt kopen tulpen en bloembollen      .,2
 Het woord bank heeft meerdere betekenissen      .,2
 Mijn jongere zusje heeft haar verlegenheid overwonnen     .,2
 Wie gooide de bal      .,2
 Een bakje yoghurt bevat miljarden goede bacteriën      .,2
 Het getalenterde meisje behaalde de hoogste cijfers      .,2
 De nieuwslezeres heeft een fijne stem      .,2
 De leeuwin heeft een jonge zebra aangevallen     .,2
 De verhuizers hebben de dure Chinese vaas laten vallen     .,2
 De leerlingenraad had een geweldige eindfeest georganiseerd     .,2
 De tuinmannen van hoveniersbedrijf 't Groene Hart hebben onze daktuin aangelegd     .,2
 De medicijnman had geneeskrachtige kruiden geplukt     .,2
 Een gekantelde vrachtwagen heeft de snelweg geblokkeerd     .,2
 Prooidieren proberen weides zonder schuilplekken te vermijden     .,2
 Het ongeluk had een lange file veroorzaakt     .,2
 De arts van het medisch centrum heeft mijn gips verwijderd     .,2
 Sommige mensen hebben vliegende schotels waargenomen     .,2
 Een enthousiaste docent stimuleert zijn leerlingen      .,2
 Rebellen hebben het parlementsgebouw bestormd     .,2
 Een katalysator versnelt het chemische proces      .,2
 De gevangengenomen soldaten moesten een kanaal graven     .,2
 Ik verveel me      .,2
 Hij zondert zich  af    .,2
 Ik heb me gehaast     .,2
 De ontsnapte criminelen schijnen zich verstopt te hebben     .,2
 De overvallers hadden zich vermomd     .,2
 De getuige van mijn aanstaande man heeft zich verslapen     .,2
 De omsingelde overvallers hebben zich overgegeven     .,2
 Uw zoon heeft zich misdragen     .,2
 De loodgieter heeft zich bezeerd     .,2
 Ik heb me vergist     .,2
 De coach gaf een handtekening aan de supporters van het succesvolle voetbalteam     .,3
 De acteur schenkt zijn salaris aan een goed doel     .,3
 Deze slager levert zijn kwaliteitsproducten aan de beste restaurants van de stad     .,3
 De oude docent wil de kennis van de Nederlandse grammatica aan de nieuwsgierige leerlingen overdragen    .,3
 Zij heeft haar spaargeld aan haar familie nagelaten    .,3
 De burgemeester zal de eresleutel van de stad aan de oudste inwoner overhandigen    .,3
 De corrupte voorzitter van de voetbalcub heeft een groot bedrag aan de scheidsrechter betaald    .,3
 De marktkoopman verkocht de vier antieke stoelen aan de verzamelaar     .,3
 De ijverige studente leende het studieboek aan haar vergeetachtige vriendin     .,3
 Leerlingen van basisschool Het wespennest zullen het geschenk aan de buitenlandse prins aanbieden    .,3
 De jonge vrouw wilde het goede nieuws aan haar ouders meedelen    .,3
 De gezakte eindexamenkandidaat vraagt advies aan haar mentor     .,3
 De slimme oplichter heeft een beter leven aan zijn slachtoffers beloofd    .,3
 Hij raadt dat boek aan mij  aan   .,3
 Een paard bewijst zijn trouw aan zijn verzorger     .,3
 De bekende voetballer van Barcelona probeerde een trucje aan de groep vrienden te leren    .,3
 Niemand vertelt zijn geheimen aan jou     .,3
 Verliefde pubers sturen briefjes aan elkaar     .,3
 Alle trotse ouders geven een bosje bloemen aan de deelnemers van de Avondvierdaagse     .,3
 De organisator van de estafetteloop schenkt het opgehaalde bedrag aan het jeugdcentrum     .,3
 Verschillende grote bedrijven leveren de onderdelen voor de auto aan de fabriek     .,3
 Je kan sommige aandoeningen aan je geliefde overdragen    .,3
 Sommige mensen willen hun erfenis aan hun huisdieren nalaten    .,3
 De verkoopster met de mooie glimlach overhandigde het tasje aan de klant     .,3
" De jongeman met de sproetjes betaalt het bedrag aan de caissière
     .",3
 De bloemist verkocht een prachtig stel rozen aan twee oude dametjes     .,3
 Mijn opa en oma leenden de boekenreeks van Dik Trom aan mijn nichtje     .,3
 De jongen bood zijn excuses aan de directeur  aan   .,3
 Ik moet dat aan mijn zus vragen    .,3
 De geschrokken autocoureur beloofde betere resultaten aan zijn sponsors     .,3
 Oplettende burgers hebben de zakkenroller aan de politie overgedragen    .,3
 De eigenaar van het complex heeft de sleutel aan mijn broer gegeven    .,3
 De enthousiaste commentator heeft verschillende complimentjes aan de sporter gegeven    .,3
 Multimiljonair Rupert Murdoch heeft een grote som geld aan het doveninstituut geschonken    .,3
 Onderzoekers hebben de schokkende resultaten aan de politie overhandigd    .,3
 Steven en Maarten hebben de boete aan de politie betaald    .,3
 De directeur van de school heeft Ipads aan de leerlingen beloofd    .,3
 De eigenaar van de souvenirwinkel heeft veel prullaria aan de toeristen verkocht    .,3
 Mijn vriendin heeft de rekening aan hem gevraagd    .,3
 De leraar vertelde de geschiedenis van het dorp aan de klas     .,3
 De cafébaas heeft een laatste rondje aan de gasten aangeboden    .,3
 De werknemer van het telecombedrijf heeft zijn vertrek aan de baas meegedeeld    .,3
 De arts heeft veel rust aan de patiënt voorgeschreven    .,3
 De dierentuin heeft de geboorte van het nijlpaardje aan het publiek meegedeeld    .,3
 Het ministerie van onderwijs heeft gratis schoolboeken aan alle leerlingen van het voortgezet onderwijs beloofd    .,3
 De politie gaf een fikse bekeuring aan de relschoppers     .,3
 De oprichter van Facebook beloofde betere privacyregels aan de gebruikers     .,3
 Sint-Maarten gaf de helft van zijn cape aan een arme man     .,3
 De koning beloofde de hand van zijn dochter aan een dappere ridder     .,3
 De automobiliste overhandigde haar rijbewijs aan de politieman     .,3
 De Jonge Jury overhandigde de eerste prijs aan de populaire schrijfster     .,3
 Het personeel van de verkoopafdeling heeft de klacht over het salaris aan de baas meegedeeld    .,3
 Het meisje heeft het balletje aan haar hond gegeven    .,3
 De voorzitter van de handbalbond overhandigde de beker aan het damesteam     .,3
 De televisiepresentator heeft de gouden plaat aan de zanger overhandigd    .,3
" De caissière
 gaf de kassabon aan de klant     .",3
 De dader van het geweldsdelict moest een schadevergoeding aan het slachtoffer betalen    .,3
 De aftredende vorstin heeft haar kroon aan haar schoondochter overgedragen    .,3
 De medewerker van het laboratorium heeft de resultaten van het onderzoek aan zijn begeleider meegedeeld    .,3
 Mijn opa en oma hebben een sterrenkijker aan mijn broer gegeven    .,3
 De ambulancebroeder heeft extra zuurstof aan de patënt gegeven    .,3
 De archeoloog heeft een bijzondere schedel aan mijn broer verkocht    .,3
 De boer moest een deel van zijn oogst aan zijn leenheer geven    .,3
 De man heeft een nier aan zijn zus gegeven    .,3
 De ambulancebroeders hebben het donorhart aan de chirurgen overhandigd    .,3
 De jarige tweeling deelde plakjes cake aan de klas  uit   .,3
 De eigenaar van het kasteeltje heeft de sleutels aan de aannemer overgedragen    .,3
 Mijn vriend heeft oplaadbare batterijen aan mij geleend    .,3
 De fotograaf gaf aanwijzingen aan het model     .,3
 Het meisje gaf een baal hooi aan haar verzorgpony     .,3
 De ober schonk een glas wijn voor de stamgast  in   .,3
 De gefortuneerde weduwe heeft een landhuis aan haar kleinzoon nagelaten    .,3
 De sympathieke spits gunde het doelpunt aan zijn teamgenoot     .,3
 De alternatieve arts heeft een speciale kruidenmix aan de patiënt voorgeschreven    .,3
 Mijn collega heeft deze sportfiets aan mij aangeraden    .,3
 De bibliothecaressse overhandigde de gereserveerde boeken aan de boekenwurm     .,3
 De rijke voetbalclub betaalde een riante opleidingsvergoeding aan de amateurclub     .,3
 De automobiliste heeft een lift aan de verdwaalde toeristen aangeboden    .,3
 De producent bood de hoofdrol aan een onbekende actrice  aan   .,3
 De brandweerman bood zijn hand aan het angstige jongetje  aan   .,3
" De circusdirecteur
 verkocht zijn tijgers aan de dierentuin     .",3
 De wethouder bood de vertrouwelijke vergaderstukken aan de journalist  aan   .,3
 De fysiotherapeut raadde een langdurige revalidatie aan de atleet  aan   .,3
 De coach vertelde de opstelling aan de journalist     .,3
 De volleybalcoach gunde een periode van rust aan de aanvaller     .,3
 Het onderzoeksbureau overhandigde het milieurapport aan de minister     .,3
 De chirurg droeg de zorg voor de patiënt aan de verpleger  over   .,3
 De rechter deelde de voorwaardelijke gevangenisstraf aan de verdachte  mee   .,3
 De presentator overhandigde de autosleutels aan de gelukkige winnaar     .,3
 De nieuwslezer deelde het overlijdensbericht aan de kijkers  mee   .,3
 Onze buurman levert de aardappelen aan dat biologische restaurant     .,3
 De staatssecretaris heeft de zwakke economische verwachtingen aan de minister-president meegedeeld    .,3
 De notaris overhandigde het koopcontract aan het enthousiaste echtpaar     .,3
 De sportvisser overhandigde de verse baars aan het visrestaurant     .,3
 De wereldreiziger stuurde allerlei kaartjes en brieven aan zijn dochters     .,3
 De coördinator mailde de noodzakelijke informatie aan de mentoren van de tweede klas     .,3
 De officier leerde de nieuwe aanvalsstrategie aan zijn eenheid     .,3
 De kunstenaar stuurde het ontwerp van het nieuwe logo aan zijn opdrachtgevers     .,3
 Hem heb ik dat boek geschonken    .,4
 Mijn collega heeft hij dat verteld    .,4
 Sommige journalisten heeft hij een leugen verteld    .,4
 Haar heeft hij een grote bos bloemen gestuurd    .,4
 Aan de winnares van de zwemfinale heeft de voorzitter van de sportbond een gouden medaille gegeven    .,4
 Jullie heeft hij een nieuwe fiets beloofd    .,4
 Mij heeft hij dat trucje geleerd    .,4
 Aan mijn buurman heeft de baas van de woingbouwvereniging een nieuwe badkamer beloofd    .,4
 Mij heeft die sluwe man de code van mijn creditcard ontfutseld    .,4
 Aan zijn directe familie heeft de onlangs overleden man een groot fortuin nagelaten    .,4
 De eigenaar van het café moet hij zijn excuses aanbieden    .,4
 Aan zijn lievelingscollega heeft de computerdeskundige het raadsel ontfutseld    .,4
 Aan de bijlesleerlingen gaf de docent extra uitleg     .,4
 Aan de dokter heeft hij de vragen gesteld    .,4
 Aan de rechter vroegen de leden van de Russische popgroep een eerlijk proces     .,4
 Mijn beste vriend heb ik mijn brommer geleend    .,4
 Wie zal ik een roos voor Valenstijnsdag geven    .,4
 De voetbalsupporters beloofde de bondscoach een klinkende overwinning     .,4
 Jullie heeft hij die keuzevak aangeraden    .,4
 Aan de uitmuntende student heeft de overheid een studiebeurs gegeven    .,4
 Aan het naaktmodel gaf de schilder duidelijke aanwijzingen     .,4
 Aan Sinterklaas heeft hij een nieuwe spelcomputer gevraagd    .,4
 Aan het hotelpersoneel gaf de directeur duidelijke instructies     .,4
 Ons raadde de hypotheekadviseur de aanschaf van een duurder huis  af   .,4
 Aan de wisselspeler gaf de coach van de A1 een belangrijke taak     .,4
 Haar geef ik een bos bloemen     .,4
" De caissière
 vroeg de klant de prijs van een pak melk     .",4
 Aan de klant heeft de winkelier de twee tassen overhandigd    .,4
 De zwerfkatjes heeft de bejaarde vrouw een blikje voer gegeven    .,4
 De Hartstichting heeft de gefortuneerde weduwe een flink bedrag geschonken    .,4
 Aan verschillende supermarkten heeft de biologische boer zijn vlees verkocht    .,4
 Aan de politie heeft de alerte winkeleigenaar de dievegges overgedragen    .,4
 Zijn broer heeft de overleden man een achttiende-eeuwse tafel nagelaten    .,4
 De uitbundige zeilsters heeft de kroonprins de medailles overhandigd    .,4
 Aan een jong gezin hebben mijn ouders hun tweede auto verkocht    .,4
 Aan de burgemeester van het pittoreske dorpje heeft de jury de oorkonde voor het mooiste dorp van Nederland overhandigd    .,4
 Sporters raadt de voedingsdeskundige dit speciale dieet  aan   .,4
 Ouders van opgroeiende kinderen heeft de diëtiste deze voedingsmiddelen afgeraden    .,4
 De bewoners van het bejaardentehuis heeft de vrijwilliger een computercursus gegeven    .,4
 De jonge kalfjes heeft de boer flesjes melk gegeven    .,4
 Aan de schorre presentator heeft de dokter keelpastilles voogeschreven    .,4
 De buitenlandse toeristen heeft de gids een rondleiding gegeven    .,4
 Haar beste vriendin heeft Tessa een ansichtkaart gestuurd    .,4
 De verkouden zangeres heeft de huisarts vitaminepillen voorgeschreven    .,4
 Zijn directe familie heeft de wetenschapper de besmettelijke ziekte overgedragen    .,4
 Mij heeft hij zijn mobiele telefoon geleend    .,4
 Hem heeft zij niks verteld    .,4
 De inwoners van het straatarme gebied heeft de stichting twee nieuwe waterputten geschonken    .,4
 Hem hebben zijn ouders een nieuwe fiets beloofd    .,4
 Aan de patiënt moest de chirurg het slechte nieuws meedelen    .,4
 Zijn opvolger droeg de rector zijn verantwoordelijkheden  over   .,4
 Aan de verlegen leerling vroeg de geschiedenislerares het juiste antwoord     .,4
 Aan de marathonloper heeft de verkoper deze speciale hardloopschoenen aangeraden    .,4
 Aan de watervlugge spits van Utrecht heeft de sportarts betere scheenbeschermers aangeraden    .,4
 Haar stuurde hij een bos rozen     .,4
 Aan de drie vriendinnen overhandigde de verhuurder de sleutels van het Spaanse appartement     .,4
 Aan de rechercheur overhandigde de politieagente het dossier van de verdachte     .,4
 Aan de bewakers van de gevangenis droeg de politie de veroordeelde crimineel  over   .,4
 Ons heeft Johan een verrassing beloofd    .,4
 Aan het dierenasiel heeft de dierenwinkelketen nieuwe hondenmanden geschonken    .,4
 Aan de fietsers zonder fietsverlichting heeft de agent een waarschuwing gegeven    .,4
 Haar zus in Amerika heeft Esther typisch Nederlandse producten gestuurd    .,4
 Aan de beste speler van het jeugdtoernooi heeft de voorzitter van de honkbalvereniging een beker overhandigd    .,4
 Aan het ziekenhuis in de Afghaanse hoofdstad heeft het goede doel medicijnen geschonken    .,4
 Aan het museum heeft de verzamelaar zijn collectie gouden en zilveren munten geschonken    .,4
 De trouwe gasten heeft de kok een gratis dessert aangeboden    .,4
 De hongerige gasten heeft de ober de pompoensoep aangeraden    .,4
 Haar kleinzoon heeft de oma een hobbelpaard beloofd    .,4
 De natgeregende leerlingen heeft de conciërge handdoeken aangeboden    .,4
 Aan de kersverse vader heeft de voedvrouw de pasgeboren baby overhandigd    .,4
 Aan hun leenheer moesten de boeren een groot deel van hun oogst overhandigen    .,4
 Aan de bestuurder van de zwaarbeladen auto had de politieagente een stopsignaal gegeven    .,4
 Aan zijn eigenwijze zoon had de vader een goede regenjas aangeraden    .,4
 Zijn collega's gaf de jonge vader beschuit met muisjes     .,4
 Aan Deense en Noorse militairen heeft de NAVO het toezicht op de conflictregio overgedragen    .,4
 Mij heeft hij alles verteld    .,4
 Zijn ouders heeft hij deze film aangeraden    .,4
 Aan dat stille meisje heeft Marco haar telefoonnummer gevraagd    .,4
 Aan de gestreste lerares heeft de bedrijfsarts veel rust voorgeschreven    .,4
 Aan zijn student legde de rijleraar de werking van de motor  uit   .,4
 Zijn ouders heeft de student betere cijfers beloofd    .,4
 Aan zijn toekomstige bruid had de pianist een reisje naar Rome beloofd    .,4
 Aan de piloot had de luchtverkeersleiding het startsein gegeven    .,4
 Aan de ambulancechauffeur vertelde de telefoniste de locatie van het ongeluk     .,4
 Aan de bierbrouwer overhandigde de directeur het eeuwenoude recept     .,4
 Aan het populaire dagblad stuurde de tekenaar zijn nieuwe spotprent     .,4
 Aan de Nederlandse wielrenner ontnamen de achtervolgers de kans op een etappeoverwinning     .,4
 Hun opa hebben de kleinkinderen een sterrenkijker gegeven    .,4
 Aan de dokterspost in Zuid-Congo schonk het Nederlandse Rode kruis een nieuwe voorraad injectienaalden     .,4
 Aan de Amerikaanse president heeft de astronaut een stukje maansteen overhandigd    .,4
 Aan de Nederlandse regering overhandigde de asielzoeker zijn paspoort     .,4
 Aan de eindexamenleerlingen vroeg biologiedocent het antwoord op de meerkeuzevraag     .,4
 Aan zijn teambaas heeft de autocoureur een overwinning beloofd    .,4
